E,It is easy app to use in or out of town.
P,Good.
N,It is good for foreigner!
E,Helpfull.
N,Really gets you what you need
E,It is easy to use!
P,Great port from website to app.
E,All the important info and reviews laid out in a user-friendly manner.
P,Love it
P,Loving it.
N,It really comes in handy when determining who to do business with.
N,Big help.
P,Best app I have in my phone
E,Handy.
R,It is not bad but hope it gets more user friendly
B,I love this app but sometimes  it doesn't  work.
N,Yelp!
E,It's super helpful when I need to make decisions on plans and purchases.
N,I just don't like you guys
N,It works like a charm for food
P,Good app.
N,Everyone i get a new phone i use this app.
N,Hasn't disapointed me.
R,"Yelp is useful but I wish it was better in some areas, they should have more deals with local businesses"
P,Great app.
R,I only wish they would give you accurate prices
P,Great ap!
E,I love the monacle part of the ap- wiah id discovered it ages ago!
N,Bad.
E,Update is so bad!
R,"No pictures load, what's the point of yelp if you can't see the photos?"
E,So helpful.
N,I'm new to my area and every time I want to try something new I go right to yelp.
N,It's a prety cool app works well no bugs so far
P,Love Yelp.
P,Love thus app.
N,I'm prety adventurous and random so this app helps me find unique food spots in unfamiliar places.
E,I love the coupons I get for checking in.
N,"Great to find what you want, where you are."
N,If you're not using Yelp!
N,"already, fix that failure and download this app immediately."
P,Horible.
N,"Ordered online, food arived and wasn't what I ordered."
N,"Non english speaking woman said ""I don't care"" and hung up."
P,"I use this every day, it's great"
E,It is very helpful.
N,I use it more when looking for new places to visit.
N,Won't dl.
N,It's been installing for 36 hrs now.
N,I restarted it's still saying installing.
N,It does what it needs to do.
E,Useful and intuitive
N,Gets worse by the minute.
N,I'm an avid yelper and always liked this app but recent updates are diminishing my opinion of it.
B,"Too many crashes, pages i used to visit often are now buried in my profile and it takes forever to load."
R,Please restore this app to its previous wonderfulness or I'll be forced to use the Web version.
P,Love this ap!
N,Really cool when trying to find new places.
N,On this aplication I can see the events page.
R,Just wish you could see the pictures you've liked.
P,Prety awesome ap!
N,Nice.
E,Always gives accurate details and descriptions.
E,It is very helpful and very useful!
E,The updated version is OK.
E,I liked the old version more
N,I use it almost daily!
E,"I  enjoy reading many of the reviews and opinions, Yelp is very useful,  the best!"
P,Cool.
P,And awesome
N,It works for me
R,I wish there was a way to filter out food carts from the listings
E,It is very helpful
N,My Go To.
N,For helping me find restaurants
E,Good pointers.
E,I like the sugestions from different people but some are really old and outdated.
P,I love Yelp!
P,And I love this Ap!
N,Never fails for me!
N,Yelp.
P,I swear by my beloved yelp
N,Just started utilizing it.
P,I like it so far.
E,I like the monocle option that shows you places you are near.
E,I also like reading reviews.
E,I enjoy leaving reviews for places especially for pleasant experiences.
E,The not so great reviews will help others I hope.
E,It is very useful!
P,A awesome
N,Filter reviews based on keywords.
N,I don't know when this feature was implemented but i just noticed it.
N,"Click on ""more reviews"" of a business page and at the top is a search box."
N,You can filter the reviews based on any text you type here.
N,This was always on the desktop site but now it's in the app as well!
E,"It is very useful for finding details about parking, specific days of the week, menu items, etc."
P,The app is now perfect.
N,Thank you!
P,Great!
E,It is very easy to use.
P,I love it!
N,"Vanessa's nails sunnyvale, SUCKS!"
N,So glad yelp exists.
N,Some places as for my comment above get so many bad reviews and it's great that the owners can't do anything to change them.
N,Because it makes it an honest place to find and search great places.
P,Good stuff
N,To dye fore.
P,This is great
P,Awesome app.
N,Never lets me down.
E,Best &really Helpful
E,"Easy, Friendly, Helpful."
E,"It is easy to join and use, does not ask for special permissions, people usually give very helpful input."
P,Favorite place!
E,Thank you Debra for your great service.
N,We will see you again
P,Love it!
N,"I'm able to share my experience with business establishments in Crestview, FL online."
P,Good ap!
N,I enjoy this app very much!
N,"I get to check in, meet new friends, write reviews, etc."
N,Your app sucks!
R,I can't write a review and see the words as I type.
N,Lame
N,I redownloaded same bs over again
E,Useful.
N,I always open up yelp before trying a new restaurant.
E,It is easy to use.
R,No email sent.
N,How am I supose to use this app if no email ever gets sent?
N,Owner.
N,Painting conyractor
N,It's really helped with my bad eating habits!
E,Soo helpful.
N,Tells you the best places to go!
E,Helpful love this ap
N,My 2nd bible.
N,I yelp therefore I am.
N,Never leave home without it
N,"I don't  use it often, but find it useful on a couple of occasions when I was on the road  and needed to select a vegan restaurant  in the vicinity."
N,Recent glitches.
B,"Normally love this ap, recently it keeps reseting over and over which is super annoying!"
N,"I use this app for uploading pictures and finding local places, but I still prefer to turn to the computer to type up reviews."
N,An aplication you'll actually use.
N,This app makes posting as easy as making a phone call.
N,I highly recommend it.
P,Love this app.
N,I yelp everything before I check it out
N,Manager.
N,Transportation industry
P,Great ap!
N,Nothing more to say.
E,It is very helpful
N,Always use it.
N,Helps me find food when i need and browse different options.
E,Comes in very handy
E,I apreciate people's food pictures.
N,"Some restraunts have names for their food, and no pictures on menus, that's one way Yelp helps me out."
E,Love this service.
E,Thanks but some reviews are NOT genuine so read up and look at them ALL
E,Best fake review app out there!
N,I downloaded this app when on vacation in a small resort town (where all the restaurants and nightclubs are on the same road.)
N,It became clear to me that there was something up with their reviews.
N,Restaurants with a lot of 1 star reviews were busier than some with 5 stars.
N,The nice 1 star restaurant we ate at didn't even have the item on the menu that one of the 1 star reviewers complained about.
N,Yelp is nothing more than the mob making businesses pay for the protection of their 5 star reviews.
P,Good to go.
N,Good app a lot of information to be had.
N,Couldn't find a place to eat without it.
E,Awesome service for crowd sourcing reviews in an easy to use app with nice maping integration.
N,Unreal.
N,"Literally, Yelp is life."
E,It is very cool.
E,It is very usefull ap
N,It works well.
E,It is easy to find reviews
N,Great way to find restaurants while traveling.
E,An essential tool when visiting a new place.
N,"Where ever we are, I can quickly find a place to eat and see what others say about the place."
P,Fantabulous!
N,(Samsung Galaxy 4).
N,"i wasn't sure about the new way of navigating on this ap,but i'm geting the hang of it!"
E,This is one of my most useful aps!
R,i would give 5 stars if i could figure out how to get my pictures to NOT post  on facebook as i Don't  have that even checked to do so!
R,Response please on how to corect this?
N,People who don't know how to review shouldn't.
N,This is not a place for your yelp business reviews pl.
N,This is a place to rate the yelp app.
N,Think before typing.
N,Other than the fact that thr majority of the yelp app ratings were penned by idiots thus making the true rating of this app unknown I found it easy to use.
P,One of the best aps I've used.
P,I love them all
N,What can I say but YES.
N,From the time that I've started using Yelp it has opened my eyes to the world of food around me.
N,"literally, I can go to any city I would like and find the best of food that is right for my palate without having to leave my car."
N,"All because of one aplication on my phone, thank you you Yelp."
N,"I would sugest this ap, this way of life to any friend I come across."
N,Events.
E,I love the event listings.
E,"I dislike the new, batery draining interface."
E,"Tedious, unthoughtful, aesthetically displeasing design to simply get up-to-date with Google's Material Design."
E,"I dislike having to keep opening the side menu to access what used to be on an apealling, quick, icon-based main page."
E,"If they had wanted to do something new and exciting, they should have developed an atractive and useful widget, not this failure."
N,Drains my batery like crazy when it's running.
E,Disapointed with the new update.
R,"Also, there is no way to turn off auto update."
P,Thee Best Ap EVER.
P,The Yelp app is one of the best aps ever!
E,The restaurant reviews are recent and the wide selection of photos allows you to see the food from a particular place before dining there.
N,These are real photos and not model photos.
E,The reviews are truthful and there's perks to checking in at certain restaurants.
N,I highly recommend downloading this ap!
N,My source for restaurant reviews.
N,I use this app as often as I can.
P,Great Ap
N,It works great.
N,No complaints from me
E,Really Confused.
N,I had heard a lot about Yelp so I decided to download the app and start leaving reviews of some of the places I had been recently.
N,And now they're all not visible on the business page.
N,What a waste of time.
N,I will be deleting the app.
N,The 2 stars is because if it weren't for my reviews being deleted I would actually like this app.
P,Good app.
E,I love the idea but not used enough to be helpful for the areas I travel to
N,Loe being able to look up restaurants and hotel ratings on trips
P,Great app.
N,To have on your phone.
P,Great Ap.
E,This is a very candid app that has helped me avoid some bad places.
N,Yelp app.
P,Love it.
E,It's slick.
P,Love it
R,If it would actually post my reviews maybe I would like the app more.
N,Update.
P,Good update .
E,History of friends check ins are inaccurate.
N,That's the only thing that is broken
P,Great ap
N,Once you yelp you won't stop
P,Love this app.
N,Has help me in more ways than one and has never failed .
P,"Great ap, a lil dumb sometimes."
E,"Search isn't always the best, but geting reviews and discounts is the best part."
N,Yelp.
E,"Yelp is the worst company ever, they are horible for consumers and small business"
N,Yelping it.
N,This app makes me hungry and then helps fill the void
P,Did a+good job  the best recommend to you
E,Reliable.
P,Ap is good.
N,It is not so sure about the reviews though.
P,Love this ap!
N,It works great.
N,Helps me to find great places to go.
E,Great and useful ap
N,Give people a heads up!
N,Finding everything.
N,It's a great help finding everything at your fingertips.
E,"Too many uninformed, pety and juvenile reviewers."
E,Ihelpful idea.
R,"There should be a gauge or indicator that shows if the vendors ever even check out their own ratings, how often and last time checked,  individual ratings read, etc.."
N,"This would show customers whether the vendor even cares or not and whether they make improvements or as many seem to,  ignore their customers."
N,Can't live with out it.
N,I'm super adidcted to reading and giving reviews !
E,It is very helpful ap
E,Extremely useful
N,Big help.
E,"Yelp assists us in finding good food, service and even activities."
N,Sucks.
R,Just want to see the menu
P,I love it.
P,I love the app.
N,"However, I can't always trust people's reviews."
N,We just have different taste in regard to food.
P,Excellent.
E,It is very helpful in selecting places to dine.
N,I don't like that I have to download the app just to write a review.
N,It works.
N,Good to know what restaurant are open and have reviews
E,Helpful.
N,"Helps me find what I need quickly, and even gets me a reservation if I need one!"
N,Gets me out of my restaurant ruts.
E,Indispensable.
P,Best critic to rely on.
N,I can now go to new places with confidence!
N,"A new Hotel, restaurant, or even theme park this app has it all."
E,Awesome comunity of people.
E,YELP IS BAD FOR BUSINESS.
N,"While many of my business' reviews are 5 star, several are not and they are reviews that YELP does not even verify that the review is in fact from a customer of MINE."
N,I flaged two damaging reviews and passed the information along to Yelp and they did not pull the reviews down.
P,Great ap
E,User friendly.
E,It is easy to use and well designed platform!
N,Restaurants.
E,"Love this ap, very informative"
N,Bene.
N,Delicious.
N,Gnocchi.
P,GREAT staff
P,Great.
P,Love this app I get great advice and tips.
N,Cannot log in.
N,I have a business page on Yelp.
B,"I am able to login with no problems through a Browser, but alway get an error with the app saying password /email wrong."
N,It is not sure what the problem is.
N,Yelp.
P,Excellent app for local businesses
N,"While on vacation in PA,."
N,I droped my phone and broke the screen.
N,The guys at uBreakiFix repaired my iPhone in about 30 minutes and it is as good as new!
E,I really apreciated the great customer service - both on the phone and in person.
P,Love love love yelp!
N,Truly a life savor!
E,"Was great, new update is not."
N,I am an avid Yelper.
N,"However, this new update (mid-March 2015) acts like it knows what you want but doesn't."
N,I can't see a list of map pins after redrawing the search.
N,It's not even an option.
E,"Considering this is a mobile ap, I think the interface should be seamless and easy to use on the go."
E,"Instead, it's clumsy and hard to navigate."
N,Don't ruin the web version next!
N,You suck.
N,Hello I'm prety mad right now.
N,I came here after working 12 hr shift .
N,I placed my drink cover
E,Love learning about new places.
N,Can't wait to check out places I've always wanted to try and making sure they're worth going to.
E,easy to use love this ap
R,Love looking for new spots and  sharing my experiences.
R,One bad review can ruin a restaurants rep.  There should be more screening.
N,My go-to.
N,I check the restaurant or business reviews on Yelp before I try any new place.
E,It is very handy
E,Fast and convenient.
E,"Yelp is fast to use when you're looking for a convenient store, place to eat, etc."
E,I love the photos and reviews.
B,Only problem is the app crashes sometimes when using the map feature (on android device ).
N,Geting adicted :).
N,I can't believe how much is on here!
N,I can't wait to catch up with friends on ratings.
N,A new reason to go out!
N,Jd byrider marieta.
N,I have been without a carnote for over 5 years and I had a few issues  with my credit.
N,I went to jd byrider and Stone completely worked made it hapen for me.
N,He was very welcoming  and when i was hapy he went the extra mile to make me hapy  and give me exactly  what i wanted.
N,If you have your heart set on a specific car stone is the guy to see!
E,He provided exceptional  service.
E,Long reserved wait time.
N,Really?
N,Why reserve.
N,Don't waste your time.
N,New upgrade.
P,I like the old yelp.
E,This new interface is not cool
N,Go Yelp!
N,Yelp is my go to app before I go anywhere.
E,Great resource for everything!
E,It is nice to have so much useful information in one place that is also socially interactive.
P,Love Yelp!
N,G303.
N,The age of grace we are living in allows us to drop a popsicle wraper on the bathroom wall watch it crawl down the wall step on it with a clean sock that won't last 5 min on the tie dye carpet
E,Frequently unusable- SLOW!
N,Who wants to watch some amateur take videos of their food - just give me a fast and stable ap!
E,Always useful.
N,"I use this app all the time, especially when travelling."
E,Be nice  be straight
N,Yummy.
E,"Clean,friendly,quick.and so Yummy!"
E,The only thing is kind of high  price .
N,but Guess you have to pay a litle more for better food.
N,I use this everywhere!
N,Technical issues.
B,Like the yelp app but it restarts on my phone a lot
B,"Yelp software, please fix this bugy Ap."
E,Wow the new update is awesome.
E,I love the aded features too.
E,So helpful and accurate.
N,I use it all the time !
P,Great for business travelers
P,Awesome!
N,"First time, and brought a friend with me."
E,"This place is great, Kathy did the best ever :)"
P,Great app.
N,No problems yet.
N,O.o
N,Epic.
P,I like it.
P,Great ap
P,i love you  guys
N,It does the job.
E,It is easy to use.
E,Indispensable.
N,"One of my 2 or 3 go to aps for finding food,  drinks,  atractions and many more things."
P,Excellent app.
E,"I use two different aps for locating places of interest, pubs and restaurants."
E,This one is more reliable and up to date on these things.
N,We travel a lot so I really rely on the reviews to make my decisions on where to go.
P,I love it!
P,Awesome.
N,I like to read other's experiences.
N,Both positive and negative.
N,Yelp to the help!
N,Yelp help you find things to do!
P,A litle biased but awesome.
N,I've been using yelp for years and years and for the most part it's prety great!
N,Yelp is my go to.
N,Food fun entertainment
P,Great ap
N,Would have been a 5 if it would stop bothering me to rate it
B,Ap crashes!
B,"Always crashing when I log in or to go to ""talk""."
N,Was fine until update .
N,Steered the right way many times.
N,Use the app whenever I want ideas of on yummy eats.
P,Love Yelp!
N,I use it as much as possible.
N,Hasn't let me down.
E,"It is easy to use, esp at my finger tips."
N,I don't go out without checking Yelp first.
E,It's Helpful.
E,"It doesn't crash, helpful info."
P,Good ap
N,Viva bargain slauson.
N,Yvete banks
P,Awesome app.
N,Got to know about so many events in and around Seatle .
N,"Being new in the area, this app really helped me fulfill my social needs !"
N,Thanks yelp
N,"Convenient when it works, but for some reason all my reviews come up ""not recommended"" :("
N,A Necessity.
N,Best way to explore your suroundings
P,Love.
N,Always my 'go-to'
E,It is very handy and helpful.
E,"Ap is very easy to use, great sugestions, easy read reviews."
P,Without a doubt the best food review app.
E,It has a lot of great features
P,I like this app.
E,Always helpful
N,Yelp get help.
N,Nice to read reviews before you spend  the money
N,Yelp it!
P,I love food
B,Crash city.
B,Keeps crashing
P,Awesome!
E,Always helpful when we travel.
E,The list of available coffees reads like a toster of PhD candidates.
E,Great coff and hospitality.
N,I heart yelp.
N,Yelp is my go to for everything!
R,Could be a litle more user friendly.
N,The app works well enough except it won't let me ad my friends from Facebook.
B,It crashes every time I try.
R,"Also, I wish there was a way to narow  searches by restaurant type."
N,Garbage.
N,Location GPS enabled search totally blows and works about 30% of the time.
N,Check-in capabilities are only slightly better.
N,It doesn't mater where I am at.
N,Only good for leaving your own reviews / tips and reading reviews [if you can manage to pull up the listing(s) you're seeking].
P,Love It.
E,Great resource to locate and read reviews of businesses.
N,"Beware, not all businesses keep their hours updated."
E,Always great places.
N,Yelp allows you to feel like a local even when you aren't!
N,Ratings for almost everything.
E,"An abundance of haters, giving a real barbell effect, but an excellent app."
N,Always seem to be improving.
N,Ok.
P,Prety good app.
E,It is easy to use.
P,Love it!
N,Great way to find out about a business before going there.
N,Nice.
N,It shows you places you never thoughy that they're there
P,Great Ap.
N,I use this app all the time.
N,Have found so many gems to eat at with the help of Yelp!
N,Download Files.
E,It is too big for my phone.
N,Go to for services!
E,Hate the new update!
B,"Every since my latest update this app keeps crashing while searching for places, can't do anything on this app without it constantly asking for me to turn on my location, can't check in any where anymore without my location being turned on!"
N,Wasn't  like that before!
N,Only the best way to be heard.
N,And also to hear what needs to be heard.
N,Weeds out trashy worthless reviews.
N,I love following my most trusted reviewers.
N,The most functional social media.
P,Great.
N,Use it 100 times a day
N,A necessity.
N,One of my daily utilities.
P,I love it.
P,Great app.
N,"I love Yelp, i use it regularly, and read about places before trying them,  and I also try to post my opinion for others, to help decide if a business is worth trying."
N,"We hate wasting money, so always Yelp before you spend."
P,Great for travel
P,Love it.
N,I like to see pictures of food or places so i enjoy yelp.
E,It's easy  to find restaurant in your area.
B,It crashes from time to time.
N,Pictures they ajust most of the time.
P,Loved it
P,Love it!
E,Great UI.
E,Clean UI.
N,Try it!
P,Great app.
N,Don't know what I would do without it
R,It could be A+.
E,Yelp is my most used app.
E,I love reading reviews and use the phone and directions integration weekly.
B,On Android the app crashes and hangs enough for negative 2 stars.
E,Solid app.
N,It does what I want very well with no muss.
P,Autotek is Awesome!
E,Their technicians and customer service is the best I've ever had I highly recommend them for any of your auto repair care!
N,terible.
E,the site is designed for people to trash businesses.
N,bad place to advertise your business.
E,"also, the customer service is absolutely horible."
N,A necessity.
N,I always use this when I'm in a new area or to find something new around where I live.
N,Every NEEDS it.
N,Try to upload a video!
N,It is not gonna hapen.
R,The app does not suport upload of a video you took.
N,You have to film it live for 12 seconds.
P,LAME!
P,Great Ap.
E,Really useful
N,My quick to find when I need it
E,It is very useful if network exists.
E,GPS integration it's nice !
N,Do I really need to see a zoom in from the full earth to the location searched everytime.
R,It needs a seting to turn this off.
E,Best Orthodon'tics in  Henderson.
E,They are so friendly and work with My sons school schedule!
N,I would refer anyone   here.
P,Because they are truly the BEST !
E,Super helpful.
P,Best app for exploring new places!
N,I don't want to download the app.
N,This site forces to download or your feedback is not welcomed via mobile phone.
P,Like it a lot.
N,Yelp or else?
N,Recent stories about establishments being threatened with poor ratings if they don't pay to advertise on Yelp.
N,Be cautious here.
P,Love it
P,Great go to app.
N,"Never fails, always leads me to just what I want."
P,Awesome.
E,Update on the app is prety nice.
E,It is very useful
N,Use it all the time
E,Useful app.
E,I love the reviews always a good read before heading any where new.
N,Have used only a few times to review.
P,Great app.
E,It is very useful
N,5 stars.
N,For Yelp
P,Perfect for traveling.
N,I use it all the time.
N,Ad video.
N,All you guys need to do is intergrate maybe 5 sec videos and it will be 5 star.
N,Fun Ap.
N,"Great way to find and submit reviews on local businesses, restaurants, and activities."
P,"Great ap, no problems!"
E,Great info.
N,It's so nice being able to look up a business and get a feel for how that business treats there customers.
N,Keep it up yelp.
B,Crashes prety regularly.
B,Crashes when I use it for too many searches in a row.
N,Aside from that it's prety good.
R,I wish it had more ways to sort the results.
N,foodie.
P,best app for foodies
P,Great app.
E,"Dependable, accurate."
E,Most usefull app for Foodies.
N,Anywhere you go yelp helps you find the best not touristic not over-rated places in most cool cities.
E,"Most reviews are made by locals and are usually fresh, forget TA, Yelp is the real deal!"
R,I wish you could 'Dislike' comments or reviews.
N,"But other than that, I have no complaints."
N,You can do everything on the app that you can on the website.
N,This is my go to app before trying/visiting any new businesses!
P,Amazing!
N,This app helps you find restaurants or places that are good or bad
N,"I love the ap, but 4 stars because it harassed the heck out of me about rating every 2 min."
P,Good stuff.
E,Quick response
E,Helpful and love it.
P,Awesome app.
N,Saves me time and money
N,My go to app.
P,I love the new app.
N,It's quicker and easier to find and post reviews.
N,Continued.
N,Refuse me in!
N,Like hello I pay every month!
N,I don't care if your a franchise.
N,As a member you sign a contract to pay a certain amount of money to get certain privileges.
E,Breach on contract!
N,Cancelling my membership and geting a three month refund.
N,Screw this fat people gym.
N,Oh and the chick at the desk name if jasmin.
R,She should be on a machine instead of behind the counter!
N,Galveston pier.
P,Great
E,This shiz is banging.
N,Thank you based god <3
E,"It is very convenient and on point , love this ap!"
N,Use it all the time.
E,I enjoy finding restaurants and reading the reviews.
N,My go-to review app.
N,I count on Yelp to help me with evaluating all kinds of businesses.
N,"Of course, one needs to read between the lines on some reviews, both negative and positive."
E,I find it extremely useful.
N,On the road again.
N,Yelp helps me find great local places to eat and safe chain eateries when I don't feel adventurous
E,Just like the website.
E,"It is easy to navigate through and convenient, but does have some technical issues every now and then."
N,Like sometimes it won't let you post your review or save it for later
P,"Yelp,is amazing"
P,Love IT.
E,It is easy to follow
P,ABSOLUTELY the best APP.
N,When it comes to seeing what's in a area and what has been said about it this is the first and only place I goto before I make a decision
N,Skip the reviews.
N,I skip the reviews and go for the photos.
E,I love see restaurants' food and menu.
