N,HTC One M8
N,Famous Fidos Rescue helped me find the perfect dog.
N,They are very friendly and continue to answer all the questions I have.
E,Exactly as described.
N,"I love the yelp ap, never have problems with it."
N,I usually look up new places before I go.
E,I received great service
P,Love it.
P,A great page
N,Review about Yelp!
N,Yelp is a great ways to look at other reviews on restaurants near and abroad with photos and or videos.
N,Plus get to make friends and get their ideas and input on where or when is the best places to eat and much more.
P,Awesome.
N,Public voting
P,The best
P,Love this app.
P,Awesome
N,Keeper.
N,Still a main stay in finding what I want.
N,It ain't perfect but it's worth the download and then some
N,Must have.
N,Yelp it up!
E,Pictures are worth 1000 words.
E,The pictures are what makes this app.
N,It was working great and all of the suden it's been a week that it stoped working :(
P,Awesome.
N,"It works great, free app."
N,What's not to like?
P,I love yelp!
P,"The best app for reviewing your favorite places to go, best option to find positively-rated establishments in new areas and a great way to share tips"
N,Yelp!
N,Nice app to find spots you may easily miss.
E,"Great reviews, too."
N,Yelp.
N,Information ?
N,Thanks
E,It is easy to use.
N,Simple efficient can't complain one bit!
N,Yelp.
P,Love it!
E,It is easy to use and resourceful.
E,"I like how i can easily find places, leave reviews and read other's."
E,It is easy to use.
N,Free.
E,And useful.
N,"Overall, a well made app."
P,Prety good.
E,It is very useful
N,Koo app.leave comments and pictures of spots you go to.
P,Good or bad.
N,Helps us all out.
E,Can be occasionally useful
N,Black male stripers.
N,Strip dancing
N,Reviews.
N,I'm a man of few words.
N,"That shouldn't mean that my review doesn't count, should it?"
N,Nice site.
N,It helped a lot
N,POOOM IT'S FIRME!
N,Yelp hasn't let me down on locations i been searching for.
N,keep on going yelpers!
P,Great Ap.
E,Fun and resourceful.
N,Essential for mobile people.
E,Good Anakin !
N,Give way to your anger!
N,Country.
P,It's cool
E,Great aplication and it's easy to use.
N,I use it daily.
N,Never again.
N,The worst H/D dealership I've ever dealt with.
E,Awesome app easy to use
E,It is very useful
P,Yelptastic.
P,Love my trust Yelp Mobile ap!
N,Use it everyday to check in and check out new places.
E,I love the update
P,Awesome food.
E,nice  local vibe!
E,Stumbled into this place with the family.loved the food and service .
N,ask for Nicks section.
E,best server!
N,Galaxy s4.
P,Loving it- still learning it :)
P,Love it!
N,I think yelp does a decent job.
N,I would like them to recommend one positive and one negative review side by side.
R,then give a option to see more reviews.
N,I have seen this done on several websites where I am looking to purchase an item.
N,I usually look at both pos and neg reviews.
E,It is very useful but had  some errors
P,Great Place I Love This Nail  Shop.
N,I've been coming here since 2008.
N,I really enjoy Lynn doing my nails and Ann doing my feet.
N,"If you want it done right, you have to try it."
P,Love this app.
E,It is easy to use
P,Good food
E,"Great food, great service."
N,I love the bq the tailgate was a great choice for our big group filled all of us up!
E,Fishbowl drinks were great!
N,Special Thanks to our waiter Mike!
P,Love this ap
N,Galaxy S5.
P,It's cool.
E,Like the deals feature when you check in to some places.
N,Previous version still good.
N,Too scared to update.
E,Nothing wrong with old version and new version looks and sounds a bit dodgy!
N,"Judging by many recent reviews, I was right to wait."
N,Sad.
N,Yelp.
N,I use it all the time!
P,Lame!
N,Won't run unless you enable gps location.
R,Won't allow you to type in the name of a location.
N,Gets stuck in a look.
N,Lamee!
N,Uninstall.
N,What You're Looking For.
E,The newest app update changed everything and it sucks.
R,"The first page should have easy access butons e.g. check in, search etc."
N,Good foog 100% mexican and vallarta
E,Hate the new design!
N,What were they thinking?
N,I primarily use yelp to find places on the go and it's ridiculously confusing with all the options in the new sidebar.
N,Was there any UI testing at all?
E,It is very helpfull.
N,Did a lot of research btwn reviews and locations to the perfect beuty salon.
N,thanks yelp
P,Great Ap.
E,It is very useful in geting the 'scoops' on local options while traveling.
N,I founds some great deals and places
N,I wish I could rate a 0.
N,The wait staff accuse someone that is wealthy enough to buy the arm pit of a bar of walking out on a 29.00 tab  really?
N,I watched him pay it and the waitress said it didn't hapen after he left.
N,That is an old game.
N,Don't go there it is an arm pit.
N,Unless you want to be called a liar and be disrespected by there hourly employees.
N,Much nicer places to go in Douglasville like  across the street or  joeys on Fairburn.
N,Don't waste your time.
P,Love it!
E,"Convenient, easy way to locate places on the go!"
E,Helpful.
E,It is easy to find what I want and filter from there
B,Frequent crashes.
E,Almost unusable.
E,The new UI update is prety but almost unusable.
B,The aplication freezes and crashes frequently.
E,It is very disapointed.
E,Great resource!
N,It's broken
N,NEEDS WORK.
E,STABLE and SMOOTH BUT LACKS POLISH.
N,"Showing businesses that are curently closed or about to close UNLESS you manually filter for ""open now"" EVERY TIME YOU SEARCH makes the results problematic."
N,Poor mix of results (searching for sushi should not include bars and piza joints).
E,"Distance finder range is not wide enough, i often need to just set the filter to search my entire city which requires going back and resubmiting the entire search - there is no filter to keep expanding the radius once the search is submited."
N,Former Customer.
N,One time I went there with 2 eyebrows and came out with 1 and a half.
P,Love Yelp!
N,Have been using yelp for years.
P,My favorite site to find restaurants!
N,Update.
E,The update really changed the app experience.
E,The interface look nice and neat.
E,I didn't expect the color changes but still its way better than the original look.
E,The update really changed my impression of the app.
N,A must have.
P,Perfect.
P,Great.but.
N,I have found many new restaurants that were great.however have also run into 2 places who have deals on this app who claim they did not place it and can't get it removed.this leaves a bad taste in my mouth and a fear to purchase any more deals.
P,The best resource of good food
N,Never failed me yet!
P,Awesome app - please pay it forward :)
N,Helps me find some great hiden gems
P,Love it!
N,I never go to a venue without checking yelp!
N,Matress Firm.
N,Store Manager
E,Reliable.
N,This is the first app I go to when looking for local places.
E,I love all the available information about its location.
N,Let's me know a lot about a place before I go.
N,Don't like being forced to download.
N,Tried to leave a review for a restaurant and yelp forces you to get their app.
N,I shouldn't be forced to download something that I don't need.
N,That's the whole point of the Internet.
P,Fantastic!
P,Great tool for eats.
N,hair stylist.
N,Colorist specialist
N,Much much much better.
P,Loove
E,It is very useful app.
N,Staff was kind.
N,All tho a budy of mine was a litle intoxicated and all of us got kicked out.
N,Even tho I was on my first beer.
N,Didn't even finish it.
P,It's all good.
N,Girls are hot.
N,Isn't that what we go to hooter for anyway.
N,Waste of time!
N,Don't bother to install this app.
N,I was excited to get this app.
B,Unfortunately this app DOES NOT work properly.
N,Every time I input something on the search bar it asks if I'm a ninja and that nothing was found try again?!@?!? Wth!
N,I already tried for the past couple of hours or so and nothing absolutely nothing works on this app.
E,It is very frustrating!
N,UNINSTALLING!
E,Awesome improvement to the app.
N,Much yelp.
E,It is very rate.
N,Wow
P,Best Ap.
N,I have found so many excellent places to eat and still searching
N,"What did you do, Yelp?"
E,Having the icons on the screen was helpful -- I could go right to what I wanted.
N,"Now I have to open the left side menu, scroll down to what I want to find, and hope the slider isn't still moving and makes me select the wrong thing."
N,So disapointed.
P,Fantastic!
E,Really and Truly helpful
P,Love this app.
N,Yelp prety much speaks for itself!
N,Nice aplication
P,Love yelp.
E,I am adicted to reviews and giving them.
P,This is a great app with some social networking included.
P,Love it
B,Great Ap but Crashes Often
N,A must have.
N,"If you don't want to fall victim to the ""i wish i knew before hand"" symptom, then you need this app."
N,Reviews by your average people who make it easier to get around and find the right and wrong places to experience
N,Like a treasure hunt.
N,I was dubious about this at first.
N,"I'll admit I didn't really see all the fuss, but my family has started using it more and more, to choose random places to try out or find things when not near home, and we've come time really enjoy our litle hunts!"
N,Owner.
N,This is by far the worst company I have ever dealt with.
E,Really useful app.
P,Great app for finding places.
E,"Food, Entertainment, services."
R,Just wish it was easier to get menus and prices for restaurants.
P,"Them this would be the all time best ""Finding Fun"" app."
P,Good.
N,Helps with what I need and givesme an idea of what I want.
N,"Dumb senseless, makes Sign in and out, pass word code, what an annoying, and"" useless thing."
N,Great Reference Ap!
N,It's the best app to determine if a place if good or reliable before you even go there.
E,"Extremely useful, not just restaurants but also for repair places, events etc!"
N,Can have enough of it!
N,Daily Necessity.
N,I use this app daily and am so thankful to each and every person who contribute reviews.
P,Love it!
N,I use yelp as a reference tool
N,Always what I want!
E,Bad service
P,Good app.
E,"It is easy to use interface and runs well, noo crashing, etc."
N,Recomended.
N,I use YELP to suport businesses in my community.
N,The YELP app is one of my favorite tools to showcase my buying experiences and suport local business.
N,Err:509
N,Yelp decides which reviews stay and which ones are deleted.
N,A friend opened an upscale Mexican restaurant and after the grand opening many were leaving favorable reviews which were deleted by yelp and for some reason kept negative comments that are not true.
N,Yelp decides which reviews stay and which ones they delete.
N,"This app does not reflect the consumers, therefore it's useless."
P,Great.
N,Good for geting to know a place before you visit
E,It is better than google maps.
N,For finding things close to you!
N,Use it often.
N,We use this app when we're on vacation or in unfamiliar local areas to find new and interesting places.
P,So far it's been good to us.
P,The best for years!
N,Been using yelp for years.
P,"I love it and when it comes to food, I live by it."
E,(5/16/2015: New interface is smooth and clean.)
N,Learning Curve.
E,"The most recent update changed the way you find and view things, and there isn't a home page, per se."
N,I still use it almost daily and enjoy competing against other locals to earn royalty points.
P,Great app.
N,I always use it to discover a new restaurant to try.
E,It is easy to use
P,Awesome.
E,nice community and all the reviews are on point with the place your looking for!
N,Muy bueno calidad.
N,Mucho gusto.
N,.5 Estrella and mas bueno para to do comer.
N,trash.
N,I tried to call in.
N,But no one answered my phone around 4:25 :(
E,It is very helpful
N,This is how I navigate NYC.
P,Love this app.
E,"UI downgrade, batery killer too."
N,Can no longer navigate app intuitively
R,I want the default filter to look for restaurants that opens now.
N,Can't
N,Completely drains my batery!
E,"The new update is beyond awful, drained my batery 70% in a few hours."
N,Off it goes!
N,"Great, but intrusive app for people wanting to save themselves from less than good experiences."
N,There's also many freebies from merchants trying to earn your business.
E,It is very handy app for travel.
E,We have been using yelp while on a hiking holiday in Sedona Arizona and found it very easy and useful.
N,Buyer beware.
N,Someone said they pay you 58 dollars to give them a good review.
N,I got fooled by the good reviews.
N,They are the worst company and bigest liers I have ever dealt with.
N,Run!
E,Great customer service and a large varieties of flavors !
P,Love it :)
N,Sucks big time.
N,Why are people leaving food and restaurant comments on here?
N,"I'd like to know others opinions on YELP, not their dining experience!"
P,Best chiropractic ever.
N,DR. SOREN HAS BEEN A LIFE SAVER I HAVE MANY BACK PROBLEMS AND MIGRAINE ISSUES AND OUT OF ANY CHIROPRACTIC I HAVE EVER BEEN TO HE IS THE ONLY ONE THAT HAS EVER HELPED ME FEEL HUMAN AGAIN AND HE IS SO REASONABLE WITHOUT INSURANCE I HAVE TO PAY UP FRONT BUT HE DOES WELL WITH WORKING WITH ME.
N,THANKS FOR ALL YOU HAVE DONE FOR ME AND MY FAMILY DR.SOREN
N,My go to app for almost everything!
N,Racism.
N,They treat people with disrespect.
N,Too much racism calling people NIGGA!
N,Won't be taken my kids to THAT place EVER!
P,Good times.
N,I eat out when I travel and live to tell people about my experiences
E,Great service.
N,Gives the public an opinion.
N,Just got this.
N,And it's telling me to rate before I even got to really use it
P,Geting to be my favorite.
N,Going to yelp!
N,When I need a good place to eat.
P,Love it!
E,Yelp is prety cool.
E,"I like this app a lot, I don't always remember to use it, but I love the concept of checking in and sharing your travels and opinion."
N,It can also really help you avoid a potential disaster.
N,Use it food hunting.
P,Love to use this app for finding new restaurant.
P,Love it.
N,I've been going to this restaurant for years and the owners are the best.
E,The food and whole concept is awesome.
E,"Some reviews say they should update the decor, but the food quality and experience over shadows the decorations."
N,You could come to this restaurant once a year and you'll be treated like you were there yesterday.
R,"No menus, great price, awesome fresh food and great drinks."
N,You can eat as much as you like all for  one low price.
N,We always make this place a night out and they never disapoint.
N,Great Dentist old school knows what hes doing
P,Love yelp!
N,I use it all the time to find out what is around and have found some great places.
N,Also I've found some bad places.
E,Love reading the reviews ;-)
N,Go to for so many local things.
N,"Have found cafes, restaurants, massage therapists, dentists, drug stores, gas stations."
N,Everything on this ap!
E,Also love monocle feature for searching out close businesses.
N,A must have app.
N,It really deserves more than just 5 stars.
E,very helpful app.
P,Just fantastic.
P,This is a great tool to use on vacation.
N,Finding local eateries is a must for us when we aren't at home.
E,I love the new look.
N,A staple.
N,But it freaks out when I switch between map and list view and erases my search :( note 3
N,Yelp Rocks!
E,Love user friendly functions and great look!
P,Amazing ap
E,Convenient.
E,This is the prety cool ap
P,Good app.
N,Good app to find new places to eat.
N,It's yelp.
E,It is very useful.
N,Make a list of countrirs where it works!
N,"Only after installing you get a messege ""not available in your country"""
E,Easy.
E,It is easy to use and easy to find businesses.
E,Yelp is a unreliable resource.
N,I have seen numerous reviews that are clearly from patrons bashing restaurants based on person opinion of individual employees.
N,I was under the impression that yelp could be looked to as a resource to find real reviews of restaurant experiences and not as a place to promote slander from disgruntled ex-employees or biter rival businesses.
E,Huge improvements!
N,Your app software.
N,Your software updates are DEFINITELY worth the time to download to my Galaxy S5.
R,"My small complaint, is to please post customer reviews for restaurants promptly, and accurately, for small places, as well as larger ones!"
R,It needs more work
P,It is very good
N,Yelps need to be shown in order.
N,"Good ap,  but they should show all of the reviews,  not the ones the like."
R,Yelps should be shown.
N,Yelp should post all yelps in order as posted.
N,Everyone should be able to yelp.
N,It is not just the ones that do it all the time.
E,Quality app.
N,It does exactly what you expect: makes reviewing restaurants much easier and looking them up a snap.
N,No major complaints really.
P,Love yelp.
E,It is very impressive
N,Please stop buging me to rate this ap
N,My opinion.
N,Everyone who is in the Fortworth area and need storage needs you should stop by storage choice on bryant Irvin road their prices were reasonable and the process was fairly quick.
P,Great.
E,Really helpful
N,Seafood!
N,Seafood is always fresh and the owner goes out of his way to make sure you are satisfied!
N,My go to place!
N,Build your own pool.
N,Custom pools
E,Outstanding design overhaul to an already essential app.
N,Keep it up
N,Trouble.
N,New software revision acting up.
P,Sad cause I love this app.
N,It works perfectly.
N,Do not understand what it could do more or why I would want it to.
P,Great.
N,Allows me to fully express my feelings about a business.
N,Yelp.
P,Great site.
N,WTF?
N,I used it daily until 3/6/15.
N,It always worked well.
B,Now the app crashes immediately when opened.
N,"I've uninstalled/reinstalled it five or six times, still no luck."
N,It's always worked on my Galaxy S3 until now!
N,"Ok here we are now 3/10, five days later and the app still crashes every time I open it."
N,I never had an issue with the app until the 3/6 update.
B,"Every time it crashes I send a report, come on people fix this, please!"
B,"Ok, today is 3/15/15, I installed the latest Yelp update, it still crashes!"
N,Sucks!
E,Prety reliable.
N,"I use every time I go out in the city, whether it's good eats, a nice smoke shop or 24hr services."
P,Love ping's.
R,"My family had been going to ping's since the 60's,  they used to be on bayard st, than they moved to mulbery st, they are  the only  one can made beef jerky taste so good, I travel from Brooklyn Just for their beef jerky, my 14 year older grandson love them too!"
N,Most in-depth app for reviews
P,Awesome!
N,But a tad bit glitchy.
N,It doesn't always work on my S4.
P,I love the app though.
N,Public storage.
E,Awesome storage faciluty!
N,Ask for raquel she is a great!
P,Love me some Yelp.
P,I love using yelp.
N,You can learn about places you've probably been passing by all your life or find something in locations you've never been before.
E,And the update is so far so great!
N,Why do I have to download the app to leave a review?
N,YOU SUCK!
N,"I really wanted to leave a positive review of a place, but aparently can't do it from my mobile without downloading your crapy, crapy, crapy app to do so."
N,Will delete the app as soon as I've left the review.
N,At least I get to leave a bad review to lower your rating.
E,"The best food ap, now with gorgeous Material Design."
P,"Yelp was already my favorite food app and website, and the implementation of a semi-Material Design makes it nearly perfect."
P,"Loving it, keep it up!"
N,Color clash.
E,"The green and red color scheme don't work so well, maybe just a St Patrick's Day thing."
N,Either way doesn't go well together.
E,Great update.
E,Love how you can see stuff now near you and than click on map and shows you exactly where all those places are and love the recommendation area.
N,Just an idea you guys have a option to look for places that deliver.
N,I think it be great to have option that shows you which ones offer online ordering.
N,It is not bad.
N,"I've noticed the ""not recommended reviews"" seem to be manipulated."
N,"Coincidence or not but they're usually negative comments about the service, product or establishment that are put in that category."
N,"It is not sure if it's Yelp or the business itself moving the favorable reviews/tips to the front and hiding the negative ones in the ""not recommended"" section."
P,Love it.
E,Ease of Google and awesome UI.
N,two problems.
N,need to have location on or typed in even when the place name is known (auto-completion).
N,cannot report duplicate entries.
N,?? that was 2011.
E,search without location services is still foo.
N,"enter a digit, as for a ZIP, drops back to alpha entry."
P,It's a great app.
N,It lets me know what's what.
N,Unethical practices.
N,"I came into the dealership yesterday,  and I already had a vehicle in mind."
N,"When we began to talk financing the vehicle,  they tried to get over on me - offering me a car note that would have me paying double the value of the car."
N,"When I informed them that I already had a lender, they refused to give me a bill of sales, stating "" we don't want to sell it to you, if you don't finance with us!"""
N,"""We get points and earn more money if you finance with us."""
N,"It needless to say, I walked out!"
P,I love it
P,Love this.
N,Use it all the time.
E,Great Idea.
B,"I love the idea behind Yelp, but I don't know why the app doesn't work on my home WiFi."
N,"I received an email telling me to uninstall the app and try again.nope, didn't work."
P,Great.
E,"Connected to what maters , and being helpful"
E,Always helpful.
P,Love this app.
N,Use it almost daily.
N,"Have found many good options for dining, entertainment and more!"
E,Fairy  accurate.
N,I'll never read a restaurant on my first timeout I've been to places where I had a bad experience the first time awesome experiments a second I don't get fed reviews and les a good bad service all the time or pet food
P,Love it!
E,It is easy to use and honest opinions that can't be bought!
N,I use it all the time!
N,Wendy willis.
N,Frequent 411 user
P,Loved it.
P,Good ap
E,It is very helpful.
E,This app is very helpful.
N,Yelp is my personal tour guide.
E,It is very old reviews.
N,No works done at all.some places not even there anymore.
P,Great app.
P,"Great ap, but please people, this section is for rating the ap, not the place you've been to."
N,The real Sarah Smile.
N,Smile
P,Great app.
E,It is very helpful
P,Love this.
B,Force Closes.
B,Force closes when I try to go into a restaurant 's detailed view.
B,Please fix for 5 stars.
P,Loved it !
P,This is the Best Place I've ever been to for having Lots of Fun.
E,"The laser tag was Great, the Skating awesome, the Arcade was wonderful and the Food couldn't be beat."
E,The customer service was The Best.
P,They treated me like family.
N,A must when you're in Baton Rouge.
N,I recommend the Skate Galaxy to Everyone !
N,Longtime user.
N,No complaints!
P,Great app.
N,I find this app very helpful when I am looking into a new business and I want to know what I am geting into.
P,Awesome app.
N,I use this app all the time
P,Great app.
N,A must have for everyone
N,Fresh Heaven men's grooming lounge.
N,They gave a new look.
E,An the shop is very unique an clean good for kids video games an more.
E,"useful tool finding good restaurant, hotel, spa, jeweler etc. make choices easier base on reviews and ratings"
P,Love yelp!
N,Lobr.
P,Hot ap
P,Awesome.
P,Great app for traveling.
N,Came in handy numerous times.
N,Especially some of the pics.
N,A+++++++
P,Great app.
E,The menus in the app are often outdated!
N,Chandler Harley Davidson.
E,"Love that place ,and the staff, Susie and her partner super job."
N,"thanks ,toni and Tony."
P,Great app.
E,It is easy to check out most anything!
N,Dirty.
N,I had dirty silverware and hair in my water.
N,I have been there several times in the past and it was good.
N,But VERY BAD experience tonight.
N,Yelp app.
P,Love it!
N,I shouldn't have to aproach them to order.
N,After 15 minutes of waiting in booth  I aproached FOUR waitresses gathered at the entrance to ask if we could order drinks.
E,Food was decent.
E,Service improved  :)
P,Great app.
E,I love being able to have my opinion on Businesses.
P,Awesome!
E,Really finding this helpful!
E,Really helpful!
N,Fun app.
E,It is easy to use.
N,You going to have it if you live in new York
N,"It is not A ""necessity""."
E,"With ""Google Now"" on our more recent phones, the act of searching for a place is only the mater of a voice command."
N,The Ability to make sure a review is seen by many however almost seemingly starts here.
E,"The site is useful, when it works."
N,Sometimes it will tell me that I am too far away to check in while I am in the actual location.
N,Glad you've upgraded so we can finalize reviews from our phones.
N,This is an upgrade from 2 stars.
N,"Since a tip and a review are not the same, allow us to either write longer tips or more than one."
N,"Drop the snarky pre-programmed comments RE length of tip, and rapidity of check-ins, since you allow some people to to many in the course of an hour."
E,Update sucks.
N,Fix and put back to normal or I erase and so don't a lot of yelp elite
E,It is very helpful app.
E,This app is one of the best and very informative.
E,This app is really helpful especially when it comes to restaurants.
P,Love it.
N,"It works everywhere, very helpful"
E,So helpful.
N,Saves time and anything rated over 4 was always great.
N,Has made dining out more enjoyable for me.
N,YELP app.
E,"Good app for keeping in the loop of local great places to eat, and where to avoid."
P,This is a great app.
N,Never crashes.
N,Just works.
N,No drama.
P,I love this app :-)
N,"Yelp is a form of yep,only in Canada do they say yelp"
E,Yelp is life lol.
P,I love yelp
N,Yelp.
N,It is very good find gps help yelp too wonderful  thanks
E,It is very helpful app and I love when I get free/discounted stuff when I check in at certain places!
N,Yelp.
P,GreAT APP i love it!
N,"I use it all the time, I have only had it like a month an i use it all the time from everything from work to dinner."
P,Great app love it
